{
  "$schema": "docs/templates/project-showroom-payload.schema.json",
  "schema": "nadlan-project-showroom-payload/v1",
  "project_slug": "rainbow-tel-aviv",
  "post_id": 4464,
  "generated_from": [
    "project-meta-example.json",
    "unit-map.json",
    "drawings.json",
    "environment.json",
    "view-layer-config.json"
  ],
  "public_use_policy": "Prototype showroom data. Replace GLB, drawings, prices and inventory with developer-approved material before removing illustrative labels.",
  "meta": {
    "project_3d_image": "",
    "project_3d_viewbox": "0 0 1000 1000",
    "project_3d_floor_height_m": "3.05",
    "project_3d_ground_elevation_m": "8",
    "project_3d_avg_price_per_sqm": "76000",
    "project_3d_price_source_note": "אומדן לא מחייב לפי מחיר ממוצע למ\"ר שמוצג במדלן לפרויקט/סביבה, נבדק 14.6.2026. לא הצעה ולא התחייבות; יש לאמת מחיר, זמינות ותנאים מול היזם.",
    "project_3d_model_type": "gltf",
    "project_model_glb": "https://raw.githubusercontent.com/The-new-ben/nad-lan-co-il/main/assets/projects/rainbow-tel-aviv/model.glb",
    "project_model_usdz": "",
    "project_model_poster": "https://raw.githubusercontent.com/The-new-ben/nad-lan-co-il/main/assets/projects/rainbow-tel-aviv/poster.png",
    "project_3d_video_url": "",
    "project_3d_tour_url": "",
    "project_3d_cesium_tiles_url": "",
    "project_3d_drawings_json": [
      {
        "label": "תרשים מיקום וסביבה",
        "type": "site_orientation",
        "url": "https://raw.githubusercontent.com/The-new-ben/nad-lan-co-il/main/assets/projects/rainbow-tel-aviv/plans/site-orientation.svg",
        "source": "המחשה מקורית לא רשמית על בסיס מקורות פומביים"
      },
      {
        "label": "תוכנית 3 חדרים",
        "type": "floor_plan",
        "url": "https://raw.githubusercontent.com/The-new-ben/nad-lan-co-il/main/assets/projects/rainbow-tel-aviv/plans/plan-3br.svg",
        "source": "המחשה מקורית לא רשמית. להחלפה בתוכנית מכר רשמית"
      },
      {
        "label": "תוכנית 4 חדרים",
        "type": "floor_plan",
        "url": "https://raw.githubusercontent.com/The-new-ben/nad-lan-co-il/main/assets/projects/rainbow-tel-aviv/plans/plan-4br.svg",
        "source": "המחשה מקורית לא רשמית. להחלפה בתוכנית מכר רשמית"
      },
      {
        "label": "תוכנית 5 חדרים",
        "type": "floor_plan",
        "url": "https://raw.githubusercontent.com/The-new-ben/nad-lan-co-il/main/assets/projects/rainbow-tel-aviv/plans/plan-5br.svg",
        "source": "המחשה מקורית לא רשמית. להחלפה בתוכנית מכר רשמית"
      },
      {
        "label": "תוכנית פנטהאוז",
        "type": "floor_plan",
        "url": "https://raw.githubusercontent.com/The-new-ben/nad-lan-co-il/main/assets/projects/rainbow-tel-aviv/plans/plan-penthouse.svg",
        "source": "המחשה מקורית לא רשמית. להחלפה בתוכנית מכר רשמית"
      },
      {
        "label": "תוכנית בוטיק",
        "type": "floor_plan",
        "url": "https://raw.githubusercontent.com/The-new-ben/nad-lan-co-il/main/assets/projects/rainbow-tel-aviv/plans/plan-boutique.svg",
        "source": "המחשה מקורית לא רשמית. להחלפה בתוכנית מכר רשמית"
      }
    ],
    "project_3d_environment_json": {
      "status": "prototype_sourced",
      "updated": "2026-06-14",
      "project": {
        "name": "Rainbow Tel Aviv",
        "district": "רובע שדה דב",
        "center": {
          "lat": 32.1108,
          "lng": 34.7805,
          "precision": "prototype",
          "source_note": "Approximate Sde Dov / Rainbow showroom center. Replace with verified project survey pin."
        }
      },
      "source_policy": "Public district and marketing facts only. No paid-source transaction rows, no official inventory claims and no unsourced exact pins.",
      "district_context": {
        "planned_units": 16000,
        "planning_area_dunam": 1300,
        "planned_population": 40000,
        "planned_commerce_sqm": 126000,
        "planned_employment_sqm": 330000,
        "planned_hotel_rooms": 2000,
        "planning_status": "Master plan approved in August 2020; detailed plans and permits are project-specific.",
        "boundaries": {
          "west": "חוף הים",
          "north": "רחוב פרופס",
          "east": "רחוב לוי אשכול",
          "south": "רחוב ש\"י עגנון"
        },
        "sources": [
          {
            "label": "עיריית תל אביב-יפו - רובע שדה דב",
            "url": "https://www.tel-aviv.gov.il/Residents/Development/Pages/SdeDov.aspx",
            "notes": "Master-plan scale, mixed-use program, parks, public buildings and transport principles."
          },
          {
            "label": "אתר המידע רובע שדה דב - שאלות ותשובות",
            "url": "https://sdedov.co.il/faq/",
            "notes": "District boundaries, 16,000 planned homes and division into Eshkol, Central and North areas."
          },
          {
            "label": "Gov.il - תכנית המתאר לרובע שדה דב",
            "url": "https://www.gov.il/he/pages/sdedov-pr-22072020",
            "notes": "Government planning announcement: 16,000 homes, public areas, commerce, employment, hotels and green areas."
          }
        ]
      },
      "layers": [
        {
          "id": "neighbor_projects",
          "label": "פרויקטים בסביבה",
          "ui": "clickable_project_chips",
          "items": [
            {
              "id": "rainbow",
              "name": "Rainbow Tel Aviv",
              "area": "אשכול",
              "status": "בשיווק / היתר בנייה לפי אתר המידע",
              "map_status": "has_project_page",
              "showroom_position": {
                "x": 0,
                "z": 0,
                "scale": 1,
                "precision": "current_project",
                "space": "relative_showroom",
                "unit": "model_meters",
                "relative_to": "rainbow-stage-origin",
                "do_not_use_as_map_pin": true
              },
              "source_url": "https://sdedov.co.il/projects/",
              "source_note": "Listed by the Sde Dov information site as a marketed project."
            },
            {
              "id": "dimri-yama",
              "name": "DIMRI YAMA",
              "area": "אשכול",
              "status": "בשיווק",
              "map_status": "needs_precise_pin",
              "showroom_position": {
                "x": -48,
                "z": -18,
                "scale": 0.72,
                "precision": "illustrative_relative",
                "space": "relative_showroom",
                "unit": "model_meters",
                "relative_to": "rainbow-stage-origin",
                "do_not_use_as_map_pin": true
              },
              "source_url": "https://sdedov.co.il/projects/",
              "source_note": "Listed by the Sde Dov information site as a marketed project."
            },
            {
              "id": "gindi-vogue",
              "name": "GINDI VOGUE",
              "area": "מרכז",
              "status": "בשיווק",
              "map_status": "needs_precise_pin",
              "showroom_position": {
                "x": 48,
                "z": -22,
                "scale": 0.78,
                "precision": "illustrative_relative",
                "space": "relative_showroom",
                "unit": "model_meters",
                "relative_to": "rainbow-stage-origin",
                "do_not_use_as_map_pin": true
              },
              "source_url": "https://sdedov.co.il/projects/",
              "source_note": "Listed by the Sde Dov information site as a marketed project."
            },
            {
              "id": "ashira",
              "name": "ASHIRA BY AVISROR",
              "area": "אשכול",
              "status": "בשיווק / הבנייה בעיצומה לפי אתר המידע",
              "map_status": "needs_precise_pin",
              "showroom_position": {
                "x": -38,
                "z": 26,
                "scale": 0.68,
                "precision": "illustrative_relative",
                "space": "relative_showroom",
                "unit": "model_meters",
                "relative_to": "rainbow-stage-origin",
                "do_not_use_as_map_pin": true
              },
              "source_url": "https://sdedov.co.il/projects/",
              "source_note": "Listed by the Sde Dov information site as a marketed project."
            },
            {
              "id": "first-by-hagag",
              "name": "FIRST BY HAGAG",
              "area": "מרכז",
              "status": "בשיווק",
              "map_status": "needs_precise_pin",
              "showroom_position": {
                "x": 38,
                "z": 28,
                "scale": 0.74,
                "precision": "illustrative_relative",
                "space": "relative_showroom",
                "unit": "model_meters",
                "relative_to": "rainbow-stage-origin",
                "do_not_use_as_map_pin": true
              },
              "source_url": "https://sdedov.co.il/projects/",
              "source_note": "Listed by the Sde Dov information site as a marketed project."
            },
            {
              "id": "zohi",
              "name": "זוהי",
              "area": "אשכול",
              "status": "בשיווק",
              "map_status": "needs_precise_pin",
              "showroom_position": {
                "x": -18,
                "z": -45,
                "scale": 0.62,
                "precision": "illustrative_relative",
                "space": "relative_showroom",
                "unit": "model_meters",
                "relative_to": "rainbow-stage-origin",
                "do_not_use_as_map_pin": true
              },
              "source_url": "https://sdedov.co.il/projects/",
              "source_note": "Listed by the Sde Dov information site as a marketed project."
            },
            {
              "id": "utopia",
              "name": "UTOPIA",
              "area": "אשכול",
              "status": "בשיווק",
              "map_status": "needs_precise_pin",